{"$schema":"https://json-schema.org/draft/2020-12/schema","additionalProperties":false,"properties":{"deterministic_artifacts":{"items":{"minLength":1,"type":"string"},"minItems":1,"type":"array"},"excluded_from_regeneration":{"items":{"minLength":1,"type":"string"},"minItems":1,"type":"array"},"files":{"items":{"additionalProperties":false,"properties":{"bytes":{"minimum":1,"type":"integer"},"path":{"minLength":1,"type":"string"},"role":{"const":"DETERMINISTIC_ARTIFACT"},"sha256":{"pattern":"^[0-9a-f]{64}$","type":"string"}},"required":["path","bytes","sha256","role"],"type":"object"},"minItems":1,"type":"array"},"generated_at_utc":{"minLength":1,"type":"string"},"schema":{"const":"EvidencePackageGenerationManifestV1"},"spec_sha256":{"pattern":"^[0-9a-f]{64}$","type":"string"}},"required":["schema","spec_sha256","generated_at_utc","files","deterministic_artifacts","excluded_from_regeneration"],"type":"object"}
