{"deterministic_artifacts":["README.md","contracts/frozen-contracts-v1.json","fixtures/fx-01.json","fixtures/fx-02.json","fixtures/fx-03.json","fixtures/fx-04.json","fixtures/fx-05.json","fixtures/fx-06.json","fixtures/fx-07.json","fixtures/fx-08.json","fixtures/fx-09.json","fixtures/fx-10.json","fixtures/fx-11.json","fixtures/fx-12.json","fixtures/fx-13.json","fixtures/fx-14.json","fixtures/fx-15.json","fixtures/fx-16.json","fixtures/fx-17.json","fixtures/fx-18.json","fixtures/fx-19.json","fixtures/fx-20.json","fixtures/fx-21.json","paths/p1.json","paths/p2.json","paths/p3.json","policies/privacy-locality-v1.json","policies/secret-patterns-v1.json","records/boundary-decision-v1.json","records/coverage-delta-v1.json","records/determinism-profile-v1.json","records/fixture-admissibility/fx-01-v1.json","records/fixture-admissibility/fx-02-v1.json","records/fixture-admissibility/fx-03-v1.json","records/fixture-admissibility/fx-04-v1.json","records/fixture-admissibility/fx-05-v1.json","records/fixture-admissibility/fx-06-v1.json","records/fixture-admissibility/fx-07-v1.json","records/fixture-admissibility/fx-08-v1.json","records/fixture-admissibility/fx-09-v1.json","records/fixture-admissibility/fx-10-v1.json","records/fixture-admissibility/fx-11-v1.json","records/fixture-admissibility/fx-12-v1.json","records/fixture-admissibility/fx-13-v1.json","records/fixture-admissibility/fx-14-v1.json","records/fixture-admissibility/fx-15-v1.json","records/fixture-admissibility/fx-16-v1.json","records/fixture-admissibility/fx-17-v1.json","records/fixture-admissibility/fx-18-v1.json","records/fixture-admissibility/fx-19-v1.json","records/fixture-admissibility/fx-20-v1.json","records/fixture-admissibility/fx-21-v1.json","records/freeze-receipt-p1-v1.json","records/freeze-receipt-p2-v1.json","records/freeze-receipt-p3-v1.json","records/oracle-adjudication-v1.json","schemas/admission-summary-v1.schema.json","schemas/boundary-decision-v1.schema.json","schemas/common-record-envelope-v1.schema.json","schemas/coverage-delta-v1.schema.json","schemas/determinism-profile-v1.schema.json","schemas/fixture-admissibility-v1.schema.json","schemas/freeze-receipt-v1.schema.json","schemas/generation-manifest-v1.schema.json","schemas/oracle-adjudication-v1.schema.json","schemas/ownership-preflight-v1.schema.json","schemas/p1-consumer-input-v1.schema.json","schemas/p2-fixture-admissibility-v1.schema.json","schemas/p3-recovery-fixture-v1.schema.json","schemas/primary-fixture-v1.schema.json","spec/evidence-conservation-v1.md","spec/evidence-conservation-v1.sha256","verification/frozen-object-verification.json","verification/lock-consistency-p1.json","verification/lock-consistency-p2.json","verification/lock-consistency-p3.json","verification/runtime-observation.json"],"excluded_from_regeneration":["admission-report.md","admission-summary.json","generation-manifest.json","records/ownership-preflight-v1.json","tests/","tools/","verification/deterministic-regeneration.json"],"files":[{"bytes":842,"path":"README.md","role":"DETERMINISTIC_ARTIFACT","sha256":"e1433b93f76d7a5064be16f15d2f2e1823a4a0813db6aac1bae7b23630473ba8"},{"bytes":6828,"path":"contracts/frozen-contracts-v1.json","role":"DETERMINISTIC_ARTIFACT","sha256":"f3ed10a3cda1b750e686c648f4bade19652f3000485aaae2a9284068e6be9b4a"},{"bytes":22723,"path":"fixtures/fx-01.json","role":"DETERMINISTIC_ARTIFACT","sha256":"c54006349460c8808281d7052a9a71b56566ba3c2d7a8efdf6a77e27f11b2fa3"},{"bytes":22723,"path":"fixtures/fx-02.json","role":"DETERMINISTIC_ARTIFACT","sha256":"e240fc52802f7cf41c56658c3e6e35fe4e08b41522f323121bd224b934027ed5"},{"bytes":22723,"path":"fixtures/fx-03.json","role":"DETERMINISTIC_ARTIFACT","sha256":"9db7dc46d9bf0aea7dad72be191d6e701926d0bb2d9c31af5f5a7028c38971eb"},{"bytes":22723,"path":"fixtures/fx-04.json","role":"DETERMINISTIC_ARTIFACT","sha256":"260c534ae6d7c6d70be09330aaaac542b3924a1c85036be971e67254056da0a4"},{"bytes":22723,"path":"fixtures/fx-05.json","role":"DETERMINISTIC_ARTIFACT","sha256":"5d8948ae1a2a5942e0dd61c71cb09e43bffd2dba3bdfac9605a0b702e7369c44"},{"bytes":22723,"path":"fixtures/fx-06.json","role":"DETERMINISTIC_ARTIFACT","sha256":"03dae1987f6bd13a24ccc6c395d149894d286ec98010cb53c89524636c0ecee8"},{"bytes":22723,"path":"fixtures/fx-07.json","role":"DETERMINISTIC_ARTIFACT","sha256":"b5807991fe74c0b170a4ffa8f76766c2ab26a169ebc49d9a51b4bc4c21ad9e7f"},{"bytes":22723,"path":"fixtures/fx-08.json","role":"DETERMINISTIC_ARTIFACT","sha256":"4a9257e438f92f84647cbdd4a4d9281a8d16f8bface26bd383adc37200c476bf"},{"bytes":22723,"path":"fixtures/fx-09.json","role":"DETERMINISTIC_ARTIFACT","sha256":"a44ab7eb935fde700bd8e64bb06f99f472b8b56fed343d5bca7382751c5d8c35"},{"bytes":22723,"path":"fixtures/fx-10.json","role":"DETERMINISTIC_ARTIFACT","sha256":"cc278cfcbe588c9ac800befc40d9739e5b1498179030eee1050e13279b2132c6"},{"bytes":22723,"path":"fixtures/fx-11.json","role":"DETERMINISTIC_ARTIFACT","sha256":"31468a35093afd3811712cb41639e467d166aa122ac75e45782ec7644e0901eb"},{"bytes":22723,"path":"fixtures/fx-12.json","role":"DETERMINISTIC_ARTIFACT","sha256":"6cb906500cc42e212847d71d011f94bd0a45e614a59db101ccf1d2555b4745ec"},{"bytes":22723,"path":"fixtures/fx-13.json","role":"DETERMINISTIC_ARTIFACT","sha256":"60165a727024a09a2503e5065049a10191f8e756b449507a2ca93dc66c923a2b"},{"bytes":22723,"path":"fixtures/fx-14.json","role":"DETERMINISTIC_ARTIFACT","sha256":"4b7f6419d06965bd837e6fcf83944edcba81211de498c07452201c2b4e67c39e"},{"bytes":22723,"path":"fixtures/fx-15.json","role":"DETERMINISTIC_ARTIFACT","sha256":"e2f9be6b3c4e642aa0dee39aedffc5df2fcc01cc32c6e3508f39faf210484f67"},{"bytes":22723,"path":"fixtures/fx-16.json","role":"DETERMINISTIC_ARTIFACT","sha256":"c756b6ce947ac2042e90cae243c1cc3c3aa26aae9e493aa0f97694e6c3ca544f"},{"bytes":22723,"path":"fixtures/fx-17.json","role":"DETERMINISTIC_ARTIFACT","sha256":"b5b1974e39aaeaae3a655df24adbcec645771f737d2afd07f60c965bc5648813"},{"bytes":22723,"path":"fixtures/fx-18.json","role":"DETERMINISTIC_ARTIFACT","sha256":"4bef6dc9aaefa46302188f64e58a61ae02f321d6b3b0e6c0549905aa41110382"},{"bytes":22723,"path":"fixtures/fx-19.json","role":"DETERMINISTIC_ARTIFACT","sha256":"707f471ee966459552cf503725d0fafaf18db7591000b4b5decad23392f96db4"},{"bytes":22723,"path":"fixtures/fx-20.json","role":"DETERMINISTIC_ARTIFACT","sha256":"3a49a8be00e15fca1b4609a529fa66f89f08d720165970d544b10ec369d11fc8"},{"bytes":22723,"path":"fixtures/fx-21.json","role":"DETERMINISTIC_ARTIFACT","sha256":"d2137fb2821b3d0a9e9529f2dcd59a825ed5d81b953fc279b8828c8bb0ecca14"},{"bytes":407,"path":"paths/p1.json","role":"DETERMINISTIC_ARTIFACT","sha256":"028dbd8832d1452cf38d348a834fc36c82629d52aceb80054188ce7f3d74d1c9"},{"bytes":438,"path":"paths/p2.json","role":"DETERMINISTIC_ARTIFACT","sha256":"e93cef95c635117358da0f4b6d86949fae06a667154924d629c6d7b9dc2feb8d"},{"bytes":378,"path":"paths/p3.json","role":"DETERMINISTIC_ARTIFACT","sha256":"bd87c5c8e7dafcd0130374d6a3401eb17f18e0f37e4f445121a655da13307ffb"},{"bytes":337,"path":"policies/privacy-locality-v1.json","role":"DETERMINISTIC_ARTIFACT","sha256":"2831c8ab521d4d560be26c0b71ce429a53a3783c4cdc3704aef553f2aea9e433"},{"bytes":402,"path":"policies/secret-patterns-v1.json","role":"DETERMINISTIC_ARTIFACT","sha256":"6d6cbdfc033af58b25340ed56da0ec605614268e0341f3e9f1b58de1c7116481"},{"bytes":878,"path":"records/boundary-decision-v1.json","role":"DETERMINISTIC_ARTIFACT","sha256":"8dd6d6028afdb00dedef87788f423d14f85616c20d03ea1744361c6790041c7b"},{"bytes":10028,"path":"records/coverage-delta-v1.json","role":"DETERMINISTIC_ARTIFACT","sha256":"39b2e63fcf6bc4e1feeeb2690814f0b879e263a2a97280646fda4f23561ff9bf"},{"bytes":2563,"path":"records/determinism-profile-v1.json","role":"DETERMINISTIC_ARTIFACT","sha256":"99d20348c67a9e307bc9ec118b49ca3c422ae9758f75dd504eac43813e35fc1d"},{"bytes":1913,"path":"records/fixture-admissibility/fx-01-v1.json","role":"DETERMINISTIC_ARTIFACT","sha256":"d1d7a6700c2277a9b34241fe2f81b4e4ae8050479eb8c17729660039653cc175"},{"bytes":1857,"path":"records/fixture-admissibility/fx-02-v1.json","role":"DETERMINISTIC_ARTIFACT","sha256":"93f5a07c6a5abd616b969a3f09e076fcd9601271a439853c22380057556b81a8"},{"bytes":2048,"path":"records/fixture-admissibility/fx-03-v1.json","role":"DETERMINISTIC_ARTIFACT","sha256":"92284c76319c497ba7b819af3ceffe6fcd77e143c2781ac17fc43c965f4c9550"},{"bytes":1941,"path":"records/fixture-admissibility/fx-04-v1.json","role":"DETERMINISTIC_ARTIFACT","sha256":"4187831e2a3880c9c135fb566310e41341f1e2adfeeaf4a794f2dbee8ca8c048"},{"bytes":1869,"path":"records/fixture-admissibility/fx-05-v1.json","role":"DETERMINISTIC_ARTIFACT","sha256":"0cf2a55d88c502020b25562594b9c6fcc572c66ec34fdbbf2fcb8624df0be840"},{"bytes":1843,"path":"records/fixture-admissibility/fx-06-v1.json","role":"DETERMINISTIC_ARTIFACT","sha256":"80903cca87c70b5dd9f54e9dbc8085c2fe630b125315b061b8c3c975e129e049"},{"bytes":2014,"path":"records/fixture-admissibility/fx-07-v1.json","role":"DETERMINISTIC_ARTIFACT","sha256":"7d71fc8935a2cc19b6e22e12d398fefe2b8fa225a768ab25c299bf8c9d1df3a4"},{"bytes":1854,"path":"records/fixture-admissibility/fx-08-v1.json","role":"DETERMINISTIC_ARTIFACT","sha256":"d55a2b1513d585dd2c12b486ed689dce303ae7f59e046b6296819f72f18b3a6c"},{"bytes":1944,"path":"records/fixture-admissibility/fx-09-v1.json","role":"DETERMINISTIC_ARTIFACT","sha256":"83c274a8d74bf706f9324fc30cdd3f763c22a1f3f07bf278183b16f21bec2a7c"},{"bytes":1961,"path":"records/fixture-admissibility/fx-10-v1.json","role":"DETERMINISTIC_ARTIFACT","sha256":"053e13e9e6be28f14f10b71097f76adef3e2ae81c1cb3b68bdd8babacb09cfca"},{"bytes":1843,"path":"records/fixture-admissibility/fx-11-v1.json","role":"DETERMINISTIC_ARTIFACT","sha256":"258391d26291f90813ce8ef80e82c0a0fabf57c7f42582f0358f8933cc0ed94e"},{"bytes":1967,"path":"records/fixture-admissibility/fx-12-v1.json","role":"DETERMINISTIC_ARTIFACT","sha256":"d64ec766645e0cc1e5d75e1d0226ff2a2eaf3a24725ff07f1c71b225996440d6"},{"bytes":2012,"path":"records/fixture-admissibility/fx-13-v1.json","role":"DETERMINISTIC_ARTIFACT","sha256":"f